NW 33-83-6 W4,Mineral Wetland / Treed Wetland / Forested,Low vegetation cover,"July 5, 2014 - Water has ponded on ditchline at screw anchor sites at multiple locations along the pipeline. July 12, 2014 - 80-85% vegetation establishment compared to off-ROW.  2013 vegetation issue resolved. - Wetlands within tract are well vegetated and stable at this time.","June 7, 2015 - Vegetation developing well along ROW.  - No subsidence or erosion issues evident from aerial assessment. Ponded water noted at screw anchors sites was no longer evident, issue resolved. - Wetlands stable throughout tract. June 10, 2015 - Vegetation on ROW is 85% compared to off-ROW control. - Roach stable with vegetation beginning to establish on it. Cross drains are functioning well at this time. - Wetlands within tract stable with good wet-tolerant vegetation establishment such as grasses and bulrushes. Hydrology appears to be maintained through wetland as indicated by saturated, organic soils. September 12, 2015 - Vegetation well established. - Soils stable with good vegetation cover, no subsidence or other integrity concerns were noted.  No additional environmental concerns were identified.","July 11, 2016 - Vegetation is well established with desirable species throughout ROW.  Good establishment of vetch, grasses and shrubs.  - No erosion or subsidence issues. - There has been recent disturbance on the east and west side of ROW. - Intermittent herbicide application conducted to control perennial sow thistle.  September 21, 2016 - 90% vegetation established compared to off-ROW. - Intermittent herbicide application conducted to control patches of Perennial Sow Thistle along ROW at KP 10+400, KP 10+500 and KP 10+650.","August 2, 2017 - Vegetation cover on the ROW is 80 - 100% compared to off-ROW control. Good establishment of grasses and shrubs - No subsidence or erosion issues were observed.  - KP 10+410 to 10+650 - Perennial sow thistle observed, recommend weed control. August 13, 2017 – KP 10+410 to 10+650 – Intermittent herbicide application conducted to control perennial sow thistle, tansy and scentless chamomile.  Issue resolved. September 11, 2017 - Woody swamp on ROW from KP 9+760 to 9+910 and shrubby swamp from KP 9+980 to 10+080 appear to be at full functionality. - Vegetation establishment throughout wetland is at 80-100% cover compared to off-ROW control. Vegetation consisting of herbaceous graminoids and willow. Hydrophytic vegetation emerging throughout wetland (common cattail & bulrush) with submergent vegetation establishing in standing water areas. - No noxious weeds were identified in wetland.  - Trench crown present through wetland but has settled due to influence from saturation. Sufficient breaks present for hydrology to be maintained. No subsidence or erosional issues identified in wetland. - Substrate in wetland appears healthy through high moisture retention, uniform vegetation growth and good organic content in topsoil layer. Humification occurring throughout wetland through large amounts of decomposing vegetation litter. - Substrate exhibiting fully saturated conditions; standing water present throughout wetland.  - Wetland providing good habitat opportunity through good vegetation cover, standing water and sufficient snags. - Wetland has achieved pre-construction contours. Off-ROW species successfully emerging onto ROW. Overall, no net loss of wetland function was observed.",,,
NW 33-83-6 W4,Watercourse,None,"July 5, 2014 - TransCanada pipeline markers have fallen over at KP 9+950.  July 12, 2104 • 80-85% vegetation establishment compared to off-ROW. - TransCanada pipeline marker sign had fallen over at KP 9+950. Sign and markers repositioned, issue resolved.","June 7, 2015 - No issues evident at watercourse. June 10, 2015 - No issues noted within watercourse.  September 12, 2015 - Vegetation well established  - Soils stable with good vegetation cover, no subsidence or other integrity concerns were noted.  No additional environmental concerns were identified.",No issues noted.,"August 2, 2017 - No issues noted.",,,
NW 33-83-6 W4,Mineral Wetland / Treed Wetland / Forested,Low vegetation cover,"July 5, 2014 - Water has ponded on ditchline at screw anchor sites at multiple locations along the pipeline. July 12, 2104 - 80-85% vegetation establishment compared to off-ROW. - Wetlands within tract are well vegetated and stable at this time.  2013 low vegetation issue resolved.","June 7, 2015 - Vegetation developing well along ROW.  - No subsidence issues evident from aerial assessment. Ponded water noted at screw anchors sites was no longer evident, issue resolved. - Wetlands stable throughout tract. June 10, 2015 - Vegetation on ROW is 85% comparable to off-ROW control. - Perennial sow thistle at KP 10+340 and KP 10+450 to KP 10+760. Recommend herbicide application. - Roach stable with vegetation beginning to establish on it. Cross drains are functioning well at this time. - Wetlands within tract appear to be stable with good wet-tolerant vegetation establishment such as grasses and bulrushes. Hydrology appears to be maintained through wetland as indicated by saturated, organic soils. - Erosion across ROW at foreign pipeline crossing at KP 10+480. Areas are vegetating at this time. Continue to monitor. September 12, 2015 - Vegetation well established. - Noxious weed control no longer required at KP 10+340 and KP 10+450 to 10+760, continue to monitor in 2016 and implement weed control measures, as required. - Soils and slopes stable with good vegetation cover, no subsidence or other integrity concerns were noted.","July 11, 2016 - Vegetation is well established with desirable species throughout ROW.  Good establishment of vetch, grasses and shrubs.  - No erosion or subsidence issues.  Erosion noted in 2015 at KP 10+480 is no longer evident, issue resolved. - There has been recent disturbance on the east and west side of ROW. - Intermittent herbicide application conducted to control perennial sow thistle.  September 21, 2016 - 90% vegetation established compared to off-ROW. - Intermittent herbicide application conducted to control patches of Perennial Sow Thistle along ROW at KP 10+400, KP 10+500 and KP 10+650.","September 11, 2017 - Woody swamp on ROW from KP 10+130 to 10+350 appears to be at full functionality. - Vegetation establishment throughout wetland is at 80-100% cover compared to off-ROW control. Vegetation consisting of herbaceous graminoids and willow. Hydrophytic vegetation emerging throughout wetland (common cattail & bulrush) with submergent vegetation establishing in standing water areas. - No noxious weeds were identified in wetland. - Trench crown present through wetland but has settled due to influence from saturation. Sufficient breaks present for hydrology to be maintained. No subsidence or erosional issues identified in wetland. - Substrate in wetland appears healthy through high moisture retention, uniform vegetation growth and good organic content in topsoil layer. Humification occurring throughout wetland through large amounts of decomposing vegetation litter. - Substrate exhibiting fully saturated conditions; standing water present throughout wetland.  - Wetland providing good habitat opportunity through good vegetation cover, standing water and sufficient snags. - Wetland has achieved pre-construction contours. Off-ROW species successfully emerging onto ROW. Overall, no net loss of wetland function was observed.",,,
SW 4-84-6 W4,Mineral Wetland / Treed Wetland / Forested,Low vegetation cover,"July 12, 2014 - 70-80% vegetation establishment compared to off-ROW. Minor patches of reduced vegetation cover present on ROW. - Minor subsidences on ditchline located at screw anchor sites throughout tract. Continue to monitor. - Wetlands within tract are well vegetated and stable at this time. - Two scentless chamomile plants were handpicked, bagged, and disposed of on ditchline at KP 11+275. - Erosion control berms are stable and well vegetated.","June 7, 2015 - Vegetation developing well along ROW.  - No subsidence or erosion issues evident from aerial assessment.  - Wetlands stable throughout tract. June 10, 2015 - Vegetation on ROW is 80-85% comparable to off-ROW control.  Low vegetation noted in 2013 is resolved. - Perennial sow thistle found throughout majority of tract. Recommend herbicide application. - ROW parallels open camp for northeast half of tract. - Roach stable and showing vegetation establishment. Cross drains are functioning well. - Wetland within tract stable with good wet tolerant vegetation establishment. Hydrology appears to be maintained as indicated through open water.  Diversion berms leading to wetland appear to be functioning well with good vegetation establishment. - No subsidence or erosional issues evident within tract.  2013 subsidence noted at screw anchors resolved. September 12, 2015 - Vegetation well established with low shrubs and willows throughout ROW  - Soils and slopes stable with good vegetation cover, no subsidence or other integrity concerns were noted.  No additional environmental concerns were identified. - Intermittent herbicide application conducted to control perennial sow thistle, common tansy, and scentless chamomile.","July 11, 2016 - Vegetation is well established with desirable species throughout ROW. Good establishment of vetch, grasses and shrubs.  - No erosion or subsidence issues. - Intermittent herbicide application conducted to control perennial sow thistle and scentless chamomile. - KP 11+300 to 11+400 – herbicide application conducted to control common tansy, foreign campsite to north of ROW likely source of weeds. September 21, 2016 - 90% vegetation established compared to off-ROW. - Herbicide application conducted to control patches of Perennial Sow Thistle at KP 10+850, KP 11+100, KP 11+200 and KP 11+500.","August 2, 2017 - Vegetation cover on the ROW is 80 - 100% compared to off-ROW control. Good establishment of grasses, shrubs, and aquatic vegetation. - No subsidence or erosion issues were observed.  - Perennial sow thistle (KP 10+800 to 11+300 and 11+550), tansy (KP 11+270 to 11+400), and scentless chamomile (KP 11+200 and 11+450) observed recommend weed control. - At KP 11+200 – foreign pipeline crossing, work was not completed at this time. August 13, 2017 – Intermittent herbicide application conducted to control perennial sow thistle (KP 10+800 to 11+300 and 11+550), tansy (KP 11+270 to 11+400), and scentless chamomile (KP 11+200 and 11+450).  Issue resolved. September 12, 2017 -Woody swamp on ROW from KP 10+910 to 11+120 and KP 11+190 to 11+250 appears to be at full functionality. - Vegetation establishment throughout wetland is at 80-100% cover compared to off-ROW control. Vegetation consisting of aspen, willow, poplar, broadleaf shrubs and herbaceous graminoids. - Trench crown present through wetland but has settled over time. Sufficient breaks present for hydrology to be maintained. Slight area of subsidence at foreign pipeline crossing (KP 11+200), not a result of TransCanada; no work required. - Substrate in wetland appears healthy through uniform vegetation growth. Humification occurring throughout wetland through the decomposing vegetation litter. Low organic content in topsoil layer comparing with off-ROW conditions. - Wetland providing good habitat opportunity through good vegetation cover and sufficient snags. - Wetland has achieved pre-construction contours. Conifer species to emerge onto ROW over time as tertiary successional species; leave for natural recovery. Overall, no net loss of wetland function was observed.",,,
NW 4-84-6 W4,Mineral Wetland / Treed Wetland / Forested,Low vegetation cover,"July 5, 2014 - Good vegetation emergence along ROW. July 12, 2014 - 75-85% vegetation establishment compared to off-ROW. Low vegetation noted in 2013 is resolved. - Wetlands within tract are well vegetated and stable at this time.","June 7, 2015 - Vegetation developing well along ROW.  - No subsidence issues evident from aerial assessment.  - Wetlands stable throughout tract. June 10, 2015 - Vegetation establishment appears to be 85% comparable to off-ROW control. - Perennial sow thistle from KP 12+475 to KP 12+670. Recommend herbicide application. - Roach stable with good vegetation establishment. Cross drains are functioning well at this time. - Wetlands throughout tract stable with establishment of wetland indicative species such as sphagnum mosses and grasses. Hydrology appears to be maintained as indicated through open water and saturated soils. - Minor erosion, within cross drain at KP 12+050, monitor. September 12, 2015 - Vegetation well established with low shrubs and willows throughout ROW - Soils and slopes stable with good vegetation cover, no subsidence or other integrity concerns were noted.  No additional environmental concerns were identified.  - Intermittent herbicide application conducted to control perennial sow thistle and scentless chamomile.","July 11, 2016 - Vegetation is well established with desirable species throughout ROW. Good establishment of vetch and grasses.  - No erosion or subsidence issues.  Erosion noted in 2015 at KP 12+050 is no longer evident, issue resolved. - Intermittent herbicide application conducted to control perennial sow thistle.  Scentless chamomile no longer evident, issue resolved. September 21, 2016 - 80-90% vegetation established compared to off-ROW. - Intermittent herbicide application conducted to control patches of Perennial Sow thistle. - Stood up marker posts and TransCanada sign at KP 12+200, issue resolved.","August 2, 2017 - Vegetation cover on the ROW is 80 - 100% compared to off-ROW control. Good establishment of grasses, shrubs, and aquatic vegetation. - No subsidence or erosion issues were observed.  - Perennial sow thistle (KP 12+000), tansy (KP 12+120) and scentless chamomile (KP 12+010) observed, recommend weed control. August 13, 2017 – Intermittent herbicide application conducted to control perennial sow thistle (KP 12+000), tansy (KP 12+120) and scentless chamomile (KP 12+010).  Issue resolved. September 12, 2017 – Woody swamp on ROW from KP 12+600 to 12+690 and KP 12+790 to 12+870 appears to be at full functionality. - Vegetation establishment throughout wetland is at 80-100% cover compared to off-ROW control. Vegetation consisting of aspen, willow, poplar, broadleaf shrubs, herbaceous graminoids, Labrador Tea and sphagnum mosses. - No noxious weeds were identified in wetland.  - Trench crown present through wetland but has settled over time. Sufficient breaks present for hydrology to be maintained. No subsidence or erosional issues identified in wetland. - Substrate in wetland appears healthy through uniform vegetation growth. Humification occurring throughout wetland through the decomposing vegetation litter. Moderate organic content in topsoil layer, comparing with off-ROW conditions. - Substrate exhibiting semi-saturated conditions, comparing with off-ROW conditions.  - Wetland providing good habitat opportunity through good vegetation cover and sufficient snags. - Wetland has achieved pre-construction contours. Conifer species to emerge onto ROW over time as tertiary successional species; leave for natural recovery. Overall, no net loss of wetland function was observed.",,,
NE 4-84-6 W4,Mineral Wetland / Treed Wetland / Forested,Low vegetation cover,"July 12, 2014 - Vegetation cover is 80% of off-ROW","June 7, 2015 - Vegetation developing well along ROW.  - No subsidence or erosion issues evident from aerial assessment.  - Wetlands stable throughout tract. June 10, 2015 - Vegetation throughout tract is 85% compared to off-ROW control. Low vegetation noted in 2013 is resolved. - Perennial sow thistle found throughout majority of tract. Recommend herbicide application. - Roach stable with vegetation establishing. Cross drains are functioning well at this time. - No subsidence or erosional issues evident within tract. September 12, 2015 - Vegetation well established with low shrubs and willows throughout ROW - Soils and slopes stable with good vegetation cover, no subsidence or other integrity concerns were noted.  No additional environmental concerns were identified. - Intermittent herbicide application conducted to control perennial sow thistle and scentless chamomile.","July 11, 2016 - Vegetation is well established with desirable species throughout ROW.  Good establishment of vetch and grasses.  - No erosion or subsidence issues. - Intermittent herbicide application to control perennial sow thistle throughout tract. September 21, 2016 - 80-90% vegetation established compared to off-ROW. - Intermittent herbicide application conducted to control patches of Perennial Sow thistle.  Scentless chamomile is no longer evident, issue resolved.","August 2, 2017 - Vegetation cover on the ROW is 80 - 100% compared to off-ROW control. Good establishment of grasses and shrubs. - No subsidence or erosion issues were observed.  - KP 12+740 to 12+760 - Perennial sow thistle observed, recommend weed control. August 13, 2017 - KP 12+740 to 12+760 – Intermittent herbicide application conducted to control perennial sow thistle and tansy.  Issue resolved.",,,
SE-9-84-6 W4,Mineral Wetland / Treed Wetland / Forested,Low vegetation cover,"July 12, 2014 - Vegetation cover 70-90% of off-ROW. Low vegetation noted in 2013 is resolved. - Wetlands throughout tract vegetation cover 80-90% of off-ROW.","June 7, 2015 - Vegetation developing well along ROW.  - No subsidence or erosion issues evident from aerial assessment.  - Wetlands stable throughout tract. June 10, 2015 - Vegetation establishment is 90% comparable to off-ROW control. - Perennial sow thistle at KP 12+750 and KP 13+050 to KP 13+280. Recommend herbicide application. - Roach stable with good vegetation establishment. Cross drains appear to be functioning well at this time. - Wetlands within tract stable with good wet-tolerant vegetation establishment. Hydrology appears to be maintained indicated by standing water and saturated, organic soils. - No subsidence or erosional issues evident within tract. September 12, 2015 - Vegetation well established with low shrubs and willows throughout ROW - Soils and slopes stable with good vegetation cover, no subsidence or other integrity concerns were noted.  No additional environmental concerns were identified. - Herbicide application conducted to control perennial sow thistle.","July 11, 2016 - Vegetation is well established with desirable species throughout ROW. Good establishment of vetch and grasses.  - No erosion or subsidence issues. - KP 13+200 – Recent disturbance at this location, with access gained from the east of the ROW. Monitor in 2017. - Intermittent herbicide application conducted to control perennial sow thistle throughout tract. September 21, 2016 - 90% vegetation established compared to off-ROW. - Herbicide application conducted to control patches of Perennial Sow Thistle at KP 13+000 and KP 13+370 and Scentless Chamomile at KP 13+470.","August 2, 2017 - Vegetation cover on the ROW is 80 - 100% compared to off-ROW control. Good establishment of grasses and shrubs. - No subsidence or erosion issues were observed.  - KP 12+860 to 12+870, 13+120 to 13+140 and 13+250 - Perennial sow thistle observed, recommend weed control. August 13, 2017 - KP 12+860 to 12+870, 13+120 to 13+140 and 13+250 – Intermittent herbicide application conducted to control perennial sow thistle.  Issue resolved.",,,
SE-9-84-6 W4,Forested,Low vegetation cover,"July 12, 2014 - Vegetation cover 70-90% of off-ROW. Low vegetation noted in 2013 is resolved.","June 7, 2015 - Vegetation developing well along ROW. - No subsidence or erosion issues evident from aerial assessment.  - Wetlands stable throughout tract. June 10, 2015 - Vegetation establishment is 90% compared to off-ROW control. - Roach stable with good vegetation establishment. Cross drains appear to be functioning well at this time. - No subsidence or erosional issues evident within tract. September 12, 2015 - Vegetation well established with low shrubs and willows throughout ROW. - Soils and slopes stable with good vegetation cover, no subsidence or other integrity concerns were noted.  No additional environmental concerns were identified.  - Perennial sow thistle identified and intermittent herbicide application conducted.","July 11, 2016 - Vegetation is well established with desirable species throughout ROW. Good establishment of vetch and grasses.  - No erosion or subsidence issues. - KP 13+200 – Recent disturbance at this location, with access gained from the east of the ROW. Monitor in 2017. - Intermittent herbicide application conducted to control perennial sow thistle throughout tract. September 21, 2016 - 90% vegetation established compared to off-ROW. - Herbicide application conducted to control patches of Perennial Sow Thistle at KP 13+000 and KP 13+370 and Scentless Chamomile at KP 13+470.","August 2, 2017 - Vegetation cover on the ROW is 80 - 100% compared to off-ROW control. Good establishment of grasses and shrubs. - No subsidence or erosion issues were observed.  - KP 12+860 to 12+870, 13+120 to 13+140 and 13+250 - Perennial sow thistle observed, recommend weed control. August 13, 2017 - KP 12+860 to 12+870, 13+120 to 13+140 and 13+250 – Intermittent herbicide application conducted to control perennial sow thistle.  Issue resolved.",,,
NE-9-84-6 W4,Mineral Wetland / Forested,Low vegetation cover,,"June 7, 2015 - - Wetlands within tract stable with good wetland indicative vegetation. Hydrology appears to be maintained as indicated by standing water and saturated, organic soils.",,"September 12, 2017 - Woody swamp on ROW from KP 13+750 to 13+920 appears to be at full functionality. - Vegetation establishment throughout wetland is at 80-100% cover compared to off-ROW control. Vegetation consisting of aspen, willow, poplar, broadleaf shrubs, herbaceous graminoids, Labrador Tea and sphagnum mosses. - No noxious weeds were identified in wetland.  - Trench crown present through wetland but has settled over time. Sufficient breaks present for hydrology to be maintained. No subsidence or erosional issues identified in wetland. - Substrate in wetland appears healthy through uniform vegetation growth. Humification occurring throughout wetland through the decomposing vegetation litter. Moderate organic content in topsoil layer, comparing with off-ROW conditions. - Substrate exhibiting semi-saturated conditions, comparing with off-ROW conditions.  - Wetland providing good habitat opportunity through good vegetation cover and sufficient snags. - Wetland has achieved pre-construction contours. Conifer species to emerge onto ROW over time as tertiary successional species; leave for natural recovery. Overall, no net loss of wetland function was observed.",,,
,Forested,Weeds,"July 5, 2014 - Good vegetation emergence along ROW.  July 12, 2014 - Vegetation cover is 70-80% of off-ROW throughout tract - KP 13+650 reduced vegetation cover at 40-50% of off-ROW - Scentless chamomile from 14+000 to meter station at the end of section, recommend weed control. July 30, 2014 - Hand-picked, bagged, and disposed of scentless chamomile located at KP 14+000 near the Cheecham Meter Station.","June 7, 2015 - Vegetation developing well along ROW.  - No subsidence or erosion issues evident from aerial assessment.  - Wetlands stable throughout tract. June 10, 2015 - Vegetation establishment appears to be 75-85% compared to off-ROW control. Low vegetation noted in 2013 and 2014 is resolved. - Perennial sow thistle found from KP 13+840 to KP 14+290, where scentless chamomile was found around the perimeter of Cheecham West meter station. Recommend herbicide application. - Roach stable with good vegetation establishment. Cross drains appear to be functioning well. - No subsidence or erosional issues evident within tract. September 12, 2015  - Vegetation was determined to be well established with low shrubs and willows throughout ROW. - Noxious weed control no longer required from KP 13+840 to KP 14+290, continue to monitor in 2016 and implement weed control measures, as required. - Soils and slopes stable with good vegetation cover, no subsidence or other integrity concerns were noted.  No additional environmental concerns were identified.","July 11, 2016 - Vegetation is well established with desirable species throughout ROW. Good establishment of vetch and grasses.  - No erosion or subsidence issues. - The recent wild fires have affected this tract. Growth has re-established well.  - Intermittent herbicide application conducted to control perennial sow thistle throughout entire tract. September 21, 2016 - 80-90% vegetation established compared to off-ROW. -Intermittent herbicide application conducted to control patches of Perennial Sow Thistle at KP 13+800, KP 13+900 and KP 14+100. - No noxious weeds observed within Cheecham meter station at KP 14+250. No scentless chamomile evident on the ROW.  Issues resolved.","August 2, 2017 - Vegetation cover on the ROW is 80 - 100% compared to off-ROW control. Good establishment of grasses, shrubs, and aquatic vegetation. - No subsidence or erosion issues were observed. - Scentless chamomile (KP 13+330) and perennial sow thistle (KP 13+690 to 13+710 and 14+260) observed, recommend weed control. August 13, 2017 – Intermittent herbicide application conducted to control scentless chamomile (KP 13+330) and perennial sow thistle (KP 13+690 to 13+710 and 14+260). Issue resolved.",,,
