Environmental Issues,Location,Mitigative Measures and Observations in 2009,Status,Recommendations,VEC,GIS,Topic
(a) fill/backfill instability,Entire route,"During the 2009 PCEM, subsidence was observed • from KP 3.3 to KP 3.8.",Unresolved,Repair and continue monitoring for trench subsidence and for excessive crown loss causing altered drainage patterns and recontour where necessary.,1. PHYSICAL ENVIRONMENT,,
(a) Alterations of natural flow patterns,Entire route,"During the 2009 PCEM, subsidence was observed • from KP 3.3 to KP 3.8.",Unresolved,Repair and continue monitoring for trench subsidence and for excessive crown loss causing altered drainage patterns and recontour where necessary.,2. WATER QUALITY AND QUANTITY,,
(a) loss of wetland habitat,Entire route,"•  Wetlands are naturally regenerating following construction. During the 2009 PCEM, low-lying areas along the • right-of-way were observed to be consistent with preconstruction drainage contours.",Resolved,None.,3. WETLANDS,,
(a) Loss or alteration of native vegetation and vegetation important to wildlife,Entire route,"Areas of poor growth were noted from KP 0.0 to • KP 1.6 along the pipeline route during the 2009 PCEM; however, vegetation establishment generally <s>appears successful along the right-of-way.</s>",Unresolved,"Broadcast seed with an approved native seed mix from KP 0.0 to KP 1.6. Continue monitoring the establishment of native vegetation.  Control trees and shrubs, if necessary, to facilitate pipeline surveillance, by mechanical rather than chemical means.",4. VEGETATION,,
(b) Weed introduction and spread,Entire route,No weeds of concern were identified during the 2009 • <s>PCEM program.</s>,Unresolved,Continue monitoring for weed growth and introduction.,4. VEGETATION,,
(a) Loss or alteration of potential wildlife habitat,Entire route,See Vegetation element. ?,Unresolved,See Vegetation element.,5. WILDLIFE AND WILDLIFE HABITAT,,
