Legal Location,1st Year (2013) Issue/Condition,2nd Year (2014) PCRM Assessment and Work Completed,3rd Year (2015) PCRM Assessment and Work Completed,4th Year (2016) PCRM Assessment and Work Completed,VEC,GIS,Topic
94P-4-J31,Low vegetation establishment,"September 17, 2014 - Scentless Chamomile was identified from KP 0+700 to KP 1+600, plants varied in size from 1-3 feet and all had dropped seed only a few plants still had visible flowers.","June 18, 2015 - Vegetation on ROW appears to be 80-85% comparable to off ROW. 2013 vegetation establishment issue resolved. 2013 vegetation cover issue resolved. - No weed issues evident within tract. 2014 noxious weed (scentless chamomile) issue resolved. - No subsidence or erosional issues evident within tract. September 29, 2015  - Vegetation establishing well with willows, small trees and shrubs observed throughout the ROW  - Soils appeared stable at the time of assessment with no apparent subsidence, erosion or contour issues. - Encana Komie road crossing stable, no erosion or subsidence was observed","June 20, 2016 - Komie East Meter Station (KP 0+000) vegetation present within fence line along east boundary - No noxious weeds observed. July 21, 2016 - No noxious weeds observed within or around the perimeter of the Komie Meter Station located at KP 0+000.  - Majority of the tract consists of riparian vegetation located within a wetland complex. - Wetland complex includes standing water across the width of the ROW between KP 0+000 and KP 0+300. Sept 25, 2016 - Vegetation continues to establish, exhibiting good growth. No noxious weeds found, no issues.",,,
94P-4-I40,Low vegetation establishment,"September 17, 2014 - Overall vegetation establishment has improved from the previous year assessment, showing approx. 80% cover to date.  2013 vegetation establishment issue resolved.","June 18, 2015 - Vegetation on ROW appears to be 80-85% comparable to off ROW. - No weed issues evident within tract. - No subsidence or erosional issues evident within tract. September 29, 2015  - Vegetation establishing well with willows, small trees and shrubs observed throughout the ROW  - Soils appeared stable at the time of assessment with no apparent subsidence, erosion or contour issues.","July 21, 2016 - Majority of the tract consists of riparian vegetation located within a wetland complex. - Wetland complex includes standing water across the width of the ROW between KP 0+000 and KP 0+300. - No issues at this time. Sept 25, 2016 - Vegetation continues to establish, exhibiting good growth. No noxious weeds found, no issues.",,,
94P-4-I50,Low vegetation establishment,"September 17, 2014 - Overall vegetation establishment has improved from the previous year assessment, showing approx. 80% cover to date. 2013 vegetation establishment issue resolved.","June 18, 2015 - Vegetation on ROW appears to be 85-90% comparable to off ROW. - Scentless chamomile present from KP 0+750 to KP 1+040. Recommend herbicide application. - No subsidence or erosional issues evident within tract. July 15, 2015 - Herbicide application conducted intermittently from KP 0+750 to 1+040 to control scentless chamomile. September 29, 2015  - Vegetation establishing well with willows, small trees and shrubs observed throughout the ROW  - Soils stable with no apparent subsidence, erosion or contour issues. - Perennial Sow Thistle was observed from KP 1+000 to KP 1+200, monitor in 2016 and implement weed control as required.","July 21, 2016 - Vegetation present along ditchline is dominated by riparian plant species. - Scentless Chamomile plants were observed in heavy patches along ditchline between KP 0+700 and KP 1+000. - Herbicide application conducted to control. Sept 25, 2016 - Previous herbicide application has proven effective.  Intermittent herbicide application to control sporadic individual scentless chamomile plants on the ROW. - Vegetation continues to establish, exhibiting good growth. No issues.",,,
94P-4-I50,Treed Bog,"September 17, 2014 - Wetland located at kp 0+400 was well drained. Cattails and other emergent riparian vegetation is present within the wetland. Mulch is present along the right-of-way and wetland vegetation is re-establishing within the mulch areas.","June 18, 2015  - Treed Bog located between kp 0+400 to kp 0+750 has standing water on south side of ROW and contains emergent riparian vegetation. - 5cm conifer saplings observed along ROW at KP 0+650. - Predominantly peat soils present within wetland. - Wetland is functional.  Issue resolved.",,,,
94P-4-I50,Rare plant - western Jacob's ladder (S4) - KP 0+800 No PCM conducted during the 2013 surveys.  Unresolved: Recommend monitoring in 2015.,"September 4, 2014 - Fifteen individuals observed on the post-construction ROW. Resolved. No further monitoring is recommended.",,,,,
94P-4-I49,Low vegetation establishment,"September 17, 2014 - Overall vegetation establishment has improved from the previous year assessment, showing approx. 80% cover to date. 2013 vegetation establishment issue resolved.","June 18, 2015 - Vegetation on ROW appears to be 85-90% comparable to off ROW. - Scentless chamomile present throughout entire tract mainly on ditchline. Recommend herbicide application. - No subsidence or erosional issues evident within tract. July 15, 2015 - Herbicide application conducted from KP 1+040 to 1+510 to control scentless chamomile. September 29, 2015  - Vegetation establishing well with willows, small trees and shrubs observed throughout the ROW. - Soils stable with no apparent subsidence, erosion or contour issues.  - Winter access road crossing stable. Vegetation height was reduced at crossing however density and composition consistent with adjacent ROW conditions.","July 21, 2016- Vegetation establishment within the tract has improving since previous years’ assessments. - Riparian plants species present within tract, no standing water present on ROW. - Scentless Chamomile plants were observed in heavy patches along ditchline between KP 1+150 and KP 1+800. - Perennial Sow Thistle plants were observed on ditchline at KP 1+600. - Herbicide application conducted to control scentless chamomile and perennial sow thistle. Sept 25, 2016 - Previous herbicide application has proven effective.  Intermittent herbicide application to control sporadic individual scentless chamomile plants on the ROW.  KP 1+000 herbicide application conducted to control perennial sow thistle. - Vegetation continues to establish, exhibiting good growth. No issues.",,,
94P-4-I48,Low vegetation establishment,"September 17, 2014 - Overall vegetation establishment has improved from the previous year assessment, showing approx. 80% cover to date. 2013 vegetation establishment issue resolved.","June 18, 2015 - Vegetation on ROW appears to be 85-90% comparable to off ROW. -  Scentless chamomile present from KP 1+680 to KP 2+000. Recommend herbicide application. - No subsidence or erosional issues evident within tract. July 15, 2015 - Herbicide application conducted intermittently from KP 1+610 to 2+010 to control scentless chamomile. September 29, 2015  - Vegetation establishing well with willows and small shrubs observed throughout the ROW  - Soils stable with no apparent subsidence, erosion or contour issues. - No Noxious or prohibited noxious weeds were observed.","July 21, 2016 - approximately 90% vegetation established compared to off ROW. - Sporadic Scentless Chamomile plants were observed along ditchline between KP 1+800 and KP 2+100. - Herbicide application conducted to control scentless chamomile  Sept 25, 2016- Previous herbicide application has proven effective. Intermittent herbicide application to control sporadic individual scentless chamomile plants on the ROW  - Vegetation continues to establish, exhibiting good growth. No issues.",,,
