Environmental Issues,Location,TERA* Mitigative Measures and Observations in 2010,TERA Mitigative Measures and Observations in 2011,Westcoast Mitigative Measures and Observations in 2012,TERA Observations in 2012,Status,Recommendations,VEC,GIS,Topic
(a) Fill/backfill instability,Entire route,--,No issues were noted during the 2011 PCEM. Trench subsidence issues are noted in element 2(d).,--,Unable to assess fill/backfill instability due to snow cover.,Unresolved,Continue monitoring for trench subsidence and for excessive crown loss causing altered drainage patterns and recontour where necessary in 2013.,1. PHYSICAL ENVIRONMENT,,
(a) Strippings/subsoil mixing,Entire route,--,No subsoil mixing issues were noted during the 2011 PCEM.,--,--,Resolved,None.,2. SOIL AND SOIL PRODUCTIVITY,,
(b) Degradation of soil structure and lowering of soil productivity through compaction and rutting,Pipeline right-of-way,--,Rutting approximately 40 cm x 100 m on east side of trench observed at KP 24.7,--,Unable to assess due to snow cover.,Unresolved,Repair rutting and monitor vegetation establishment in 2013.,2. SOIL AND SOIL PRODUCTIVITY,,
(c) Soil erosion,Steep slopes,North and south approach slopes to watercourse from KP 4.2 to KP 5.2 required grading during construction. Potential exists for erosion on slopes.,Unable to access watercourse due to ground conditions.,--,Unable to assess soil erosion due to snow cover.,Unresolved,Monitor erosion and vegetation establishment in 2013.,2. SOIL AND SOIL PRODUCTIVITY,,
(c) Soil erosion,Pipeline right-of-way,--,--,Repair of erosion gully alongside of trench crown from KP 6.8 to KP 7.0completed winter 2012/2013.,Unable to assess soil erosion due to snow cover.,Unresolved,Confirm repair success in 2013.,2. SOIL AND SOIL PRODUCTIVITY,,
(c) Soil erosion,Pipeline right-of-way,--,"Combination of water flow, susceptible soil and vehicle ruts leading to erosion gully 60 cm deep from KP 7.1 to KP 7.2.",--,Unable to assess soil erosion due to snow cover.,Unresolved,Repair gully erosion and monitor vegetation establishment in 2013.,2. SOIL AND SOIL PRODUCTIVITY,,
(c) Soil erosion,Pipeline right-of-way,--,Erosion rill (15 cm x 10 cm x 10 m) at KP 13.0.,Repair of erosion rill planned for fall 2012.,Unable to assess soil erosion due to snow cover.,Unresolved,Confirm repair success and monitor vegetation establishment in 2013.,2. SOIL AND SOIL PRODUCTIVITY,,
(c) Soil erosion,Pipeline right-of-way,--,--,Recontouring between KP 13.0 to KP 15.6 completed winter 2012/2013.,Unable to assess contouring due to snow cover.,Unresolved,Confirm repair success and monitor vegetation establishment in 2013.,2. SOIL AND SOIL PRODUCTIVITY,,
(c) Soil erosion,Pipeline right-of-way,--,--,Repair of erosion gullies at KP 17.0 planned for 2013.,Unable to assess erosion due to snow cover.,Unresolved,Confirm repair success and monitor vegetation establishment in 2013.,2. SOIL AND SOIL PRODUCTIVITY,,
(c) Soil erosion (cont’d),Pipeline right-of-way,--,Erosion gully (60 cm x 2 m x 10 m) at KP 17.1.,--,Unable to assess erosion due to snow cover.,Unresolved,Repair gully erosion and monitor vegetation establishment in 2013.,2. SOIL AND SOIL PRODUCTIVITY,,
(c) Soil erosion (cont’d),Pipeline right-of-way,--,--,Repair of subsidence and erosion at KP 18.4 completed winter 2012/2013.,Unable to assess due to snow cover.,Unresolved,Confirm repair success and monitor vegetation establishment in 2013.,2. SOIL AND SOIL PRODUCTIVITY,,
(c) Soil erosion (cont’d),Pipeline right-of-way,--,Erosion rill (20 cm x 30 cm x 5 m) at KP 20.3.,Repair of erosion completed winter 2012/2013.,Unable to assess erosion due to snow cover.,Unresolved,Confirm repair success and monitor vegetation establishment in 2013.,2. SOIL AND SOIL PRODUCTIVITY,,
(c) Soil erosion (cont’d),Pipeline right-of-way,--,Erosion rill (10 cm x 30 cm x 5 m) from KP 23.75 to KP 23.8.,--,Unable to assess due to snow cover.,Unresolved,Repair rill erosion and monitor vegetation establishment in 2013.,2. SOIL AND SOIL PRODUCTIVITY,,
(d) Trench subsidence,Pipeline right-of-way,Subsidence observed intermittently between KP 0.5 and KP 2.0. Issue causing water to pond.,No subsidence was noted from KP 0.5 to KP 1.0.  Unable to access right-of-way from KP 1.0 to KP 4.0.,--,Unable to assess subsidence due to snow cover.,Unresolved,"Repair subsidence, if warranted, and continue monitoring in 2013.",2. SOIL AND SOIL PRODUCTIVITY,,
(d) Trench subsidence,Pipeline right-of-way,--,Subsidence (30 cm x 2 m x 5 m) at KP 12.0.,--,Unable to assess subsidence due to snow cover.,Unresolved,"Repair subsidence, if warranted, and continue monitoring in 2013.",2. SOIL AND SOIL PRODUCTIVITY,,
(d) Trench subsidence,Pipeline right-of-way,--,Subsidence (20 cm x 8 m x 10 m) at KP 15.2.,--,Unable to assess subsidence due to snow cover.,Unresolved,"Repair subsidence, if warranted, and continue monitoring in 2013.",2. SOIL AND SOIL PRODUCTIVITY,,
(d) Trench subsidence,Pipeline right-of-way,--,Subsidence (30 cm x 20 m x 5 m) at KP 15.6.,--,Unable to assess subsidence due to snow cover.,Unresolved,"Repair subsidence, if warranted, and continue monitoring in 2013.",2. SOIL AND SOIL PRODUCTIVITY,,
(d) Trench subsidence,Pipeline right-of-way,Subsidence observed intermittently between KP 17.1 and KP 19.0. Issue causing water to pond.,Subsidence (75 cm x 3 m x 3 m) observed at KP 18.4.,--,Unable to assess subsidence due to snow cover.,Unresolved,"Repair subsidence, if warranted, and continue monitoring in 2013.",2. SOIL AND SOIL PRODUCTIVITY,,
(d) Trench subsidence,Pipeline right-of-way,--,Subsidence (50 cm x 10 m x 5 m) at KP 23.5.,--,Unable to assess subsidence due to snow cover.,Unresolved,"Repair subsidence, if warranted, and continue monitoring in 2013.",2. SOIL AND SOIL PRODUCTIVITY,,
(d) Trench subsidence,Pipeline right-of-way,--,Subsidence (60 cm x 4 m x 2 m) at KP 24.2.,--,Unable to assess subsidence due to snow cover.,Unresolved,"Repair subsidence, if warranted, and continue monitoring in 2013.",2. SOIL AND SOIL PRODUCTIVITY,,
(d) Trench subsidence,Pipeline right-of-way,--,Subsidence (30 cm x 8 m x1 m) at KP 25.5.,--,Unable to assess subsidence due to snow cover.,Unresolved,"Repair subsidence, if warranted, and continue monitoring in 2013.",2. SOIL AND SOIL PRODUCTIVITY,,
(d) Trench subsidence (cont’d),Pipeline right-of-way,--,Subsidence (30 cm x 10 m x 1 m) at KP 26.1.,--,Unable to assess subsidence due to snow cover.,Unresolved,"Repair subsidence, if warranted, and continue monitoring in 2013.",2. SOIL AND SOIL PRODUCTIVITY,,
(d) Trench subsidence (cont’d),Pipeline right-of-way,--,Subsidence (30 cm x 10 m x 1 m) at KP 26.55.,--,Unable to assess subsidence due to snow cover.,Unresolved,"Repair subsidence, if warranted, and continue monitoring in 2013.",2. SOIL AND SOIL PRODUCTIVITY,,
(d) Trench subsidence (cont’d),Pipeline right-of-way,--,Subsidence (30 cm x 15 m x 5 m) from KP 36.4 to KP 36.5.,--,Unable to assess subsidence due to snow cover.,Unresolved,"Repair subsidence, if warranted, and continue monitoring in 2013.",2. SOIL AND SOIL PRODUCTIVITY,,
(d) Trench subsidence (cont’d),Pipeline right-of-way,--,Subsidence (40 cm x 2 m x 2 m) at KP 36.6.,--,Unable to assess subsidence due to snow cover.,Unresolved,"Repair subsidence, if warranted, and continue monitoring in 2013.",2. SOIL AND SOIL PRODUCTIVITY,,
(a) Alterations of natural flow patterns,Pipeline right-of-way,Water from hydrostatic testing ponding in low-lying areas near KP 0.0.,Poor drainage noted at KP 0.0. Standing water observed intermittently from KP 0.0 to KP 1.0.,--,Unable to assess drainage due to snow cover.,Unresolved,Recontour the right-of-way and monitor in 2013.,3. WATER QUALITY AND QUANTITY,,
(a) Alterations of natural flow patterns,Entire route,--,Trench settlement issues causing high crown along the right-of-way can potentially alter natural flow patterns. See Trench Subsidence element. No water flow issues of concern were identified in 2011.,--,Unable to assess natural flow patterns due to snow cover.,Unresolved,Continue monitoring trench settlement along the entire right-of-way in 2013.,3. WATER QUALITY AND QUANTITY,,
(a) Loss of wetland habitat and loss or reduction of hydrological function (filtration),Entire route,--,"During the 2011 PCEM, low-lying areas along the right-of-way were observed to be consistent with pre-construction drainage contours.",--,--,Resolved,"Continue monitoring the re-establishment of ground cover, soil erosion potential and weed growth.",4. WETLANDS,,
(a) Loss or alteration of native vegetation and vegetation important to wildlife,Entire route,Low-growing shrubs and grasses were observed along the right-of-way at the time of the PCEM program but require more time to establish.,Low-growing shrubs and grasses continue to establish well but require further monitoring.,--,Unable to assess vegetation due to snow cover.,Unresolved,Continue to monitor the re-establishment of low-growing shrubs and grasses on the right-of-way.,5. VEGETATION,,
(b) Weed introduction and spread,Pipeline right-of-way,--,Narrow-leaved hawk's-beard was observed at low densities along the entire route during the 2011 PCEM.,--,Unable to assess weeds due to snow cover.,Unresolved,Continue monitoring right-of-way for weed growth and introduction in 2013.,5. VEGETATION,,
(b) Weed introduction and spread,Pipeline right-of-way,--,Sweet clover was observed at low densities along the entire line and in moderate densities at KP 14.7 and from KP 28.0 to KP 30.0 during the 2011 PCEM.,--,Unable to assess weeds due to snow cover.,Unresolved,Continue monitoring right-of-way for weed growth and introduction in 2013.,5. VEGETATION,,
(b) Weed introduction and spread,Pipeline right-of-way,--,Scentless chamomile was observed at low densities along the majority of the pipeline with a high density infestation at KP 14.7.,--,Unable to assess weeds due to snow cover.,Unresolved,Apply chemical control for scentless chamomile. Continue monitoring right-of-way for weed growth and introduction in 2013.,5. VEGETATION,,
(b) Weed introduction and spread,Lay down yard on Liard Highway,--,--,Spraying for Scentless chamomile at KP 42.0 planned for fall 2012.  Follow up treatments planned for 2013 and 2014.,Unable to assess weeds due to snow cover.,Unresolved,Continue monitoring for weed issues in 2013,5. VEGETATION,,
(b) Weed introduction and spread,Pipeline right-of-way,--,--,Spraying for scentless chamomile at KP 14.6 planned for fall 2012.  Follow up treatments planned for 2013 and 2014.,Unable to assess weeds due to snow cover.,Unresolved,Continue monitoring for weed issues in 2013,5. VEGETATION,,
(c) Loss of rare plant populations,30 locations,"Flagged rare plant populations in October 2009. Reduced work site dimensions and lessened disturbance to vegetation by minimising grubbing and/or ramping over rare plant populations in flagged locations. At flagged rare plant locations, stripped a narrow blade width centered over the trench. If rare plants were flagged in areas where grading was required, stripped and stored grubbings and strippings separately and marked their location to ensure these materials were replaced in the same area during clean‐up.","Revisited rare plant populations of European water-hemlock, northern bog bedstraw and western Jacob's-ladder.",--,Rare plants not assessed in 2012.,"8 unresolved, 22 resolved",Continue to monitor the 8 unresolved populations of rare plants.,5. VEGETATION,,
(c) Loss of rare plant populations (cont’d),See above,"At flagged rare plant locations, placed swamp or rig mats over the spoil side and placed ditch spoil on top of the mats, to prevent ditch spoil from mixing with the unstripped surface materials. Replaced strippings in areas of rare plants in the same location as they were removed.",<s>See above</s>,<s>See above</s>,<s>See above</s>,<s>See above</s>,<s>See above</s>,5. VEGETATION,,
(a) Loss or alteration of potential wildlife habitat,Entire route,--,--,--,--,Unresolved,See Vegetation element.,6. WILDLIFE AND WILDLIFE HABITAT,,
,1 km from pipeline right-of-way,"An additional borrow site was acquired from British Columbia Crown lands. Site was approximately 1 km from pipeline, immediately adjacent and accessible by road. The trees and brush were removed, topsoil stripped and stockpiled on-site and the small borrow pit was developed. Borrow site was left with stable slope angles and public access is restricted. Drainage for the hydrostatic test water was established before the water was released. Water was released into an excavated sump under controlled conditions before it flowed into natural drainage in the area. Area was reseeded.",Area not assessed in 2011.,--,Unable to assess due to snow cover.,Unresolved,"Assess borrow pit area for general environmental condition (weeds, vegetation establishment, drainage etc.) in 2013.",7. OTHER,,
