Legal Land Description,Land Use,Condition/Issues Noted (Rating),KP,Notes,2015 PCRM Assessment and Work Completed,VEC,GIS,Topic
SE 1-54-15 W4,wetland,Vegetation issue (moderate),0+000 to 0+060,"The ROW is revegetating well, but few wetland species were observed during the field survey. The majority of the wetland and wetland species appear to be north of the pipeline ROW, the construction of the pipeline has had limited to no impact on the vegetative composition of the ROW.","July 10, 2015 • The area continues to revegetate with bunch and creeping grasses spreading throughout the RoW • No erosion, subsidence or integrity concerns were identified at the time of the assessment. Oct 6, 2015 • The area continues to revegetate with bunch and creeping grasses spreading throughout the RoW • No erosion, subsidence or integrity concerns were identified at the time of the assessment.",,,
SE 1-54-15 W4,wetland,Noxious weed issue (moderate),0+000 to 0+075,Noxious weeds are present (Canada thistle and perennial sow thistle). Noxious weeds are more severe off ROW.,"July 10, 2015 • Assessed weeds throughout tract • Canada Thistle, Perennial Sow Thistle, Narrow Leaf Hawkweed, Common Tansy and large amount of sweet clover were observed directly east of the Atco gas valve site and the western bar ditch of Hwy 857.  Oct 6, 2015 • Canada Thistle, Perennial Sow Thistle, Narrow Leaf Hawkweed, were observed directly east of the Atco gas valve site and the western bar ditch of Hwy 857.  • Recommend monitoring with possible vegetation control for next growing season all vegetation killed by frost",,,
SW 6-54-14 W4,cropland,Noxious weed issue (low),0+075 to 0+250,"Located on a small natural wet area. Noxious weeds (Canada thistle and perennial sow thistle) are present, which will be managed by normal farming operations.","July 10, 2015 • Tract is located in cropland and is currently producing canola • Tract was not accessed due to LO concerns • No concerns were visible from boundary at time of assessment Oct 6, 2015 • Tract is currently in Canola and not harvested at the time of the assessment, therefore the tract was not accessed. • No concerns were visible from boundary at time of assessment ",,,
SW 6-54-14 W4,cropland,Noxious weed issue (low),0+415 to 0+465,Site is on the edge of a small natural wet area that extends 25m to the south of the ROW. Noxious weeds (Canada thistle) are present.,"July 10, 2015 • Tract is located in cropland and is currently producing canola • Tract was not accessed due to LO concerns Oct 6, 2015 • Tract is currently in Canola and not harvested at the time of the assessment, therefore the tract was not accessed.",,,
SW 6-54-14 W4,cropland,No issue observed,0+700,Crop is comparable to the Control. Landowner’s refuse storage site was located just off the ROW.,"July 10, 2015 • Tract is located in cropland and is currently producing canola • Tract was not accessed due to LO concerns Oct 6, 2015 • Tract is currently in Canola and not harvested at the time of the assessment, therefore the tract was not accessed.",,,
SW 6-54-14 W4,wetland,Noxious weed issue (moderate),0+720 to 0+760,"Class II wetland observed. Scentless chamomile was observed on the ROW. Moderate issue as the noxious weeds were picked, bagged and sealed in a plastic bag and properly disposed of (approx. 10 plants).","July 10, 2015 • Tract was not accessed due to landowner concerns with access. Oct 6, 2015 • Tract was not accessed due to landowner concerns with access. ",,,
,cropland,Microtopography issue (Moderate),0+775 to 0+855,There is approximately a 5 cm to 10 cm difference between grade on and off ROW. This may be associated with an old fence line. Topsoil was greater than 29 cm was observed on the ROW and on the control. The uneven topography can be attributed to the old fence line. No soil issues were observed.,"July 10, 2015 • Tract is located in cropland and is currently producing canola • Tract was not accessed due to landowner concerns • No concerns were visible from boundary at time of assessment Oct 6, 2015 • Tract is currently in Canola and not harvested at the time of the assessment, therefore the tract was not accessed.",,,
,cropland,Vegetation issue (moderate),0+775 to 0+855,Crop height and density decreased compared to the off-ROW Control. Noxious weeds (Canada thistle) are present which will be managed by normal farming operations.,"July 10, 2015 • Tract is located in cropland and is currently producing canola • Tract was not accessed due to landowner concerns • No concerns were visible from boundary at time of assessment Oct 6, 2015 • Tract is currently in Canola and not harvested at the time of the assessment, therefore the tract was not accessed.",,,
SE 6-54-14 W4,Treed (wind break),Vegetation issue (high),0+900 to 0+920,Drainage ditch (man-made) to the east. High percent cover of invasive plants and nuisance weeds were observed; few desirable species present.,"July 10, 2015 • Tract is located in crop land however a shelterbelt along the western boundary of the quarter section was removed during construction.  • Canada Thistle, Perennial Sow Thistle, Narrow Leaf Hawkweed and Common Tansy were identified in the location of the previous shelterbelt • Recommend vegetation control ",,,
,cropland,Vegetation issue (moderate),0+925 to 1+300,"There is a decrease in crop height and density compared to off-ROW Control. No soil issues on the ROW were observed to provide an explanation of the decrease in crop height and density. Few noxious weeds are present, which will be managed by normal farming operations.","July 10, 2015 • Two separate crops appear to have been seeded at separate times. • West portion of tract, crop density, height and maturity appear to be impacted. While off RoW crop throughout the field in this area also varied in density, height and maturity at the time of assessment the RoW was observed to have reduced crop density, height and maturity compared to general offsite conditions. • No erosion, subsidence or integrity concerns were identified at the time of the assessment. Oct 6, 2015 • Quarter was seeded to Barley this past season, stubble at the time of assessment.  Height and density of stubble consistent on and off RoW.  • Dug soil pits in four locations on and off the ROW (KP 1+600, 1+300, 1+200, 1+100) and 40 meters south due to potential compaction concern.  Soil replacement is comparable both on and off ROW (14-15cm topsoil on ROW, 16cm topsoil off).  No indication of compaction was observed, roots moving downward and no signs of root stress.  • No erosion, subsidence or integrity concerns were identified at the time of the assessment. • No noxious weeds observed at time of assessment ",,,
,cropland (harvested),No issues observed,1+510,Some wood was found on ROW likely buried and brought up during construction. Larger pieces were removed at the time of field work.,"July 10, 2015 • Crop density height and maturity appeared to be consistent with off RoW conditions at the time of assessment. • Soils along eastern portion of tract were found to be consistent with offsite conditions • A pile of wooden debris located on ROW. Oct 6, 2015 • Dug soil pits in four locations on and off the ROW (KP 1+600, 1+300, 1+200, 1+100) and 40 meters south due to potential compaction concern.  Soil replacement is comparable both on and off ROW (14-15cm topsoil on ROW, 16cm topsoil off).  No indication of compaction was observed, roots moving downward and no signs of root stress.  • No erosion, subsidence or integrity concerns were identified at the time of the assessment. • No noxious weeds observed at time of assessment  • A pile of wooden debris remains on ROW, remove as soon as practical in 2016.",,,
SW 5-54-14 W4,cropland,No issues observed,"1+825, 1+930, and 2+270",No issues. Crop is comparable to the Control.,"July 10, 2015 • Crop density and height were comparable to off RoW conditions at time of assessment. • A slight depression was noted directly east of the marker signs located along the eastern bar ditch of RR 145. The feature did not appear to have impacted land use at the time of the assessment as crop height, density and maturity were observed to be consistent with off RoW conditions at the time of assessment. • Recommend reassessment following the removal of the crop to determine the extent of the feature. • No erosion, additional subsidence or integrity concerns were identified at the time of the assessment. Oct 6, 2015 • Tract is Wheat stubble, height and density of stubble is comparable on and off RoW.  • Assessed soils throughout tract. • During discussion with the landowner he had noted a subsidence directly east of the access gate.   Landowner has concern with depression located at KP 1+700 in approximate • area of the road bore.  Repairs are recommended to occur in 2016. • No erosion, additional subsidence or integrity concerns were identified at the time of the assessment.",,,
,Watercourse (unnamed tributary to Vermillion River) / wetland,Noxious weed issue (moderate),2+470 to 2+540,"Noxious weeds are present (Canada thistle and perennial sow thistle). The noxious weeds off ROW are more severe than on the ROW. There is a moderate cover of noxious weeds currently on the ROW. Erosion control measures are functional. There is no evidence of erosion or subsidence on hill slopes.  Some rutting (unrelated to construction activities) was observed, but repairing the rutting would cause more disturbance and potential damage than has already occurred (KP 2+470).","July 10, 2015 • Canada Thistle, Perennial Sow Thistle and Common Tansy were identified throughout the riparian area of the water course crossing • Watercourse: • Banks were found to be stable with no evidence of erosion or other integrity concerns. • Vegetation continuing to establish along banks and throughout the riparian area of the crossing.  • Soils throughout the riparian area were found to be stable at the time of assessment with no evidence of erosion or other concerns.  Oct 6, 2015 • Canada Thistle, Perennial Sow Thistle were identified throughout the riparian area of the water course crossing • Potential vegetation control next season • Assessed Watercourse crossing  • Banks were found to be stable with no evidence of erosion or other integrity concerns. • Vegetation continuing to establish along banks and throughout the riparian area of the crossing.  • Rutting, no longer a concern, area is fully vegetated, issue resolved. • Soils throughout the riparian area were found to be stable at the time of assessment with no evidence of erosion or other concerns. • Watercourse dry at time of assessment ",,,
SE 5-54-14 W4,cropland,No issues observed,2+820,No issues. ROW is revegetating very well - crop is comparable to the Control.,"July 10, 2015 • Crop density height and maturity were comparable to off RoW conditions at time of assessment.  • No erosion, subsidence or integrity concerns were identified at the time of the assessment. • No weed concerns were identified throughout tract at time of site assessment Oct 6, 2015 • Stubble density and height were comparable to off RoW conditions at time of assessment.  • No erosion, subsidence or integrity concerns were identified at the time of the assessment. • No weed concerns were identified throughout tract at time of site assessment ",,,
