Legal Land Description,1st Year Issue/ Condition,1st Year (2014) Issue(s),2nd Year (2015) PCRM Assessment and Work Completed,3rd Year (2016) PCRM Assessment and Work Completed,4th Year (2017) PCRM Assessment and Work Completed,5th Year (2018) PCRM Assessment and Work Completed,VEC,GIS,Topic
SE 6-54-14 W4,Cropland Vegetation issue (0+925 to 1+300),"There is a decrease in crop height and density compared to off-ROW Control. No soil issues on the ROW were observed to provide an explanation of the decrease in crop height and density. Few noxious weeds are present, which will be managed by normal farming operations.","July 10, 2015 - Two separate crops appear to have been seeded at separate times. - West portion of tract, crop density, height and maturity appear to be impacted. While off ROW crop throughout the field in this area also varied in density, height and maturity at the time of assessment the ROW was observed to have reduced crop density, height and maturity compared to general offsite conditions. - No erosion, subsidence or integrity concerns were identified. Oct 6, 2015 - Quarter was seeded to Barley this past season, stubble at the time of assessment. Height and density of stubble consistent on and off ROW.  - Dug soil pits in four locations on and off the ROW (KP 1+600, 1+300, 1+200, 1+100) and 40 meters south due to potential compaction concern. Soil replacement is comparable both on and off ROW (14-15cm topsoil on ROW, 16cm topsoil off). No indication of compaction was observed, roots moving downward and no signs of root stress.  - No erosion, subsidence or integrity concerns were identified. - No noxious weeds observed","June 15, 2016 - Crop land, seeded to canola. - Crop on ROW is comparable to off ROW, no issues noted. August 19, 2016 - Crop land, seeded to canola. - Crop on ROW is comparable to off ROW, no issues noted. - Reduction in crop density noted in 2014 (KP 0+925 to 1+300) and 2015 are no longer evident, issues resolved.","July 31, 2017 - Tract is seeded to wheat; previous location of weed control is grassy area between quarters along undeveloped road allowance - Observed a few sporadic individuals of perennial sow thistle and Canada thistle, less than observed off ROW. No further weed control required, issue resolved.","June 12, 2018 - 80-100% vegetation cover compared to off ROW appears to be seeded to wheat. - No erosion or subsidence observed on ROW - Canada thistle observed within grassy area between quarters along undeveloped road allowance. Recommend weed control. July 21, 2018 – Herbicide application conducted within grassy area along undeveloped road allowance to control Canada thistle.",,,
,Cropland No issues observed (1+510),Some wood was found on ROW likely buried and brought up during construction. Larger pieces were removed at the time of field work.,"July 10, 2015 - Crop density height and maturity appeared to be consistent with off RoW conditions at the time of assessment. - Soils along eastern portion of tract were found to be consistent with offsite conditions - A pile of wooden debris located on ROW. Oct 6, 2015 - Dug soil pits in four locations on and off the ROW (KP 1+600, 1+300, 1+200, 1+100) and 40 meters south due to potential compaction concern. Soil replacement is comparable both on and off ROW (14-15cm topsoil on ROW, 16cm topsoil off). No indication of compaction was observed, roots moving downward and no signs of root stress.  - No erosion, subsidence or integrity concerns were identified. - No noxious weeds observed. - A pile of wooden debris remains on ROW, remove as soon as practical in 2016.","June 15, 2016 - The brush pile (wooden debris) that was present last year has been removed, issue resolved.",,,,,
SW 5-54-14 W4,"Cropland No issues observed (1+825, 1+930, and 2+270)",No issues. Crop is comparable to the Control.,"July 10, 2015 - Crop density and height were comparable to off ROW conditions. - A slight depression was noted directly east of the marker signs located along the eastern bar ditch of RR 145. The feature did not appear to have impacted land use as crop height, density and maturity were observed to be consistent with off ROW conditions at the time of assessment. - Recommend reassessment following the removal of the crop to determine the extent of the feature. - No erosion, additional subsidence or integrity concerns were identified. Oct 6, 2015 - Tract is Wheat stubble, height and density of stubble is comparable on and off ROW.  - Landowner has concern with depression located at KP 1+700 in approximate area of the road bore. Repairs are recommended to occur in 2016. - No erosion, additional subsidence or integrity concerns were identified.","April 21 2016 - Completed subsidence repairs reported by Landowner in 2015 at KP 1+700. Issue resolved - Landowner was present for on-site meeting and walked the repair. He was very pleased with the job, thanked us for the timely repair. June 15, 2016 - Crop land seeded to canola. - Subsidence repaired area has poor crop emergence compared to rest of the ROW - Remaining ROW, the crop density and height were very comparable to off ROW conditions. August 19, 2016 - Subsidence repaired area has poor growth not comparable to rest of the ROW, monitor in 2017. - Remaining ROW, the crop density and height were very comparable to off ROW conditions.","June 16, 2017 - Tract is seeded to annual crop wheat - Wet conditions prevented assessment at this time. July 26, 2017 - KP 1+700 to 1+750 – 2016 subsidence repair - Crop height, vigor and density are reduced in the topsoil import area with dimensions 20 m by 50 m. Measurements on ROW: height 55 cm, 65 stems/m and 6 cm head length. Off ROW measurements: height 80 cm, 80 stems/m and 7.5 cm head length. - Remaining portion of the ROW is consistent with off ROW. - KP 2+260 - Minor subsidence observed on ditch line. Issue is not currently impacting land use and farming operations are expected to alleviate issue. Monitor in 2018.","June 12, 2018 - 80-100% vegetation cover compared to off ROW. Appears to be seeded to wheat crop. Previously noted reduced crop height, vigor, and density were no longer observed, issue resolved. - No erosion or subsidence observed on ROW. All previously noted subsidence issues resolved.",,,
,Watercourse (unnamed tributary to Vermillion River) / wetland Noxious weed issue (2+470 to 2+540),"Noxious weeds are present (Canada thistle and perennial sow thistle). The noxious weeds off ROW are more severe than on the ROW. There is a moderate cover of noxious weeds currently on the ROW. Erosion control measures are functional. There is no evidence of erosion or subsidence on hill slopes.  Some rutting (unrelated to construction activities) was observed, but repairing the rutting would cause more disturbance and potential damage than has already occurred (KP 2+470).","July 10, 2015 - Canada Thistle, Perennial Sow Thistle and Common Tansy were identified throughout the riparian area of the water course crossing Watercourse: - Banks were found to be stable with no evidence of erosion or other integrity concerns. - Vegetation continuing to establish along banks and throughout the riparian area of the crossing.  - Soils throughout the riparian area were found to be stable at the time of assessment with no evidence of erosion or other concerns.  Oct 6, 2015 - Canada Thistle, Perennial Sow Thistle were identified throughout the riparian area of the water course crossing - Potential vegetation control next season - Assessed Watercourse crossing  - Banks were found to be stable with no evidence of erosion or other integrity concerns. - Vegetation continuing to establish along banks and throughout the riparian area of the crossing.  - Rutting, no longer a concern, area is fully vegetated, issue resolved. - Soils throughout the riparian area were found to be stable at the time of assessment with no evidence of erosion or other concerns. - Watercourse dry","June 15, 2016 - Banks were stable with no evidence of erosion or other integrity concerns. - Vegetation established along banks and throughout the riparian area of the crossing.  - Weeds present Canada thistle, perennial sow Thistle, kochia, recommend vegetation control. August 19, 2016 - Banks were stable with no evidence of erosion or other integrity concerns. - Vegetation established along banks and throughout the riparian area of the crossing.  - Weeds present Canada thistle, perennial sow Thistle, kochia, recommend vegetation control. September 22, 2016 - Intermittent herbicide application (spot spraying) conducted to control Perennial Sow Thistle and Canada Thistle between KP 2+450 and KP 2+550. Kochia no longer present.","July 26, 2017 - KP 2+450 to 2+550 - Perennial sow thistle and Canada thistle observed in comparable density on and off ROW. No work required, issue resolved. - No erosion or stability issues were observed at the unnamed tributary at 2+500. Sept 20, 2017 - Class III wetland on RoW from KP 2+470 to 2+540 appears to be at baseline, full functionality. Wetland is inclusive of riparian zone to Unnamed Creek at KP 2+500. - Vegetation establishment throughout wetland is at 80-100% cover compared to off ROW control. Vegetation consisting of herbaceous graminoids and willows. Good establishment of hydrophytic vegetation (common cattail, lilly pads, milfoil). - No trench crown present through wetland; hydrology has been maintained across ROW. No subsidence or erosional issues identified in wetland. - Substrate in wetland appears healthy through uniform vegetation growth and high moisture retention capabilties. Some humification occurring throughout wetland through the decomposing vegetation litter. High organic content in topsoil layer; comparing with off ROW conditions. - Substrate exhibiting semi to fully saturated conditions. - Wetland providing good habitat opportunity through good vegetation cover, sufficient snags and standing water. - Wetland has achieved pre-construction contours. Off ROW species successfully emerging onto ROW; species diversity maintained. Overall, no net loss of wetland function was observed.","June 12, 2018 - Unnamed Watercourse Crossing. - Banks are stable and vegetated. - Exhibiting moderate flow. - Marker posts are up and functioning. August 14, 2018 - Class III wetland on ROW from KP 2+470 to 2+540 appears to be at baseline (pre-construction) conditions with no net apparent loss of wetland function observed. Proper wetland functionality has been attained. Wetland is inclusive of riparian zone to Unnamed Creek at KP 2+500. - Vegetation establishment throughout wetland is at 80-100% cover compared to off ROW control.  - Vegetation consisting of herbaceous graminoids and willows. Good establishment of hydrophytic vegetation (common cattail, lily pads, duck weed water milfoil). - No trench crown present through wetland; hydrology has been maintained across ROW with no apparent signs of any hydrologic connectivity issues. - Substrate in wetland appears healthy through uniform vegetation growth and high moisture retention capabilities. Some humification occurring throughout wetland through the decomposing vegetation litter. High organic content in topsoil layer; comparing with off RoW conditions. Organic scent emitting from standing water areas indicating the effective decomposition of plant material via bacterial organisms. - Substrate exhibiting semi-saturated conditions leading into the watercourse with a depth of >40cm. No issues of flow observed within watercourse. - Wetland providing good habitat opportunity through good vegetation cover, sufficient snags and standing water. Amphibians observed using wetland as habitat. - Wetland has achieved pre-construction contours with no signs of ponding, soil stability, erosion or subsidence issues. Off ROW species successfully emerging onto ROW; species diversity maintained.",,,
SE 5-54-14 W4,Cropland No issues observed (2+820),No issues. ROW is revegetating very well - crop is comparable to the Control.,"July 10, 2015 - Crop density height and maturity were comparable to off RoW conditions. - No erosion, subsidence or integrity concerns were identified. - No weed concerns were identified throughout tract. Oct 6, 2015 - Stubble density and height were comparable to off RoW conditions. - No erosion, subsidence or integrity concerns were identified. - No weed concerns were identified throughout tract at time of site assessment","June 15, 2016 - Crop land seeded to canola - Crop density, height, and vigor were comparable to off RoW conditions.  - No issues identified. August 19, 2016 - Crop land seeded to canola - Crop density, height, and vigor were comparable to off RoW conditions.  - No issues identified.","July 31, 2017  - Tract seeded to wheat, no issues identified.","June 12, 2018 - 80-100% vegetation cover compared to off ROW appears to be seeded to wheat. - No erosion or subsidence observed on ROW",,,
