Legal Land Description,1st Year Issue/ Condition,1st Year (2014) Issue(s),2nd Year (2015) PCRM Assessment and Work Completed,3rd Year (2016) PCRM Assessment and Work Completed,4th Year (2017) PCRM Assessment and Work Completed,5th Year (2018) PCRM Assessment and Work Completed,VEC,GIS,Topic
SE 1-54-15 W4,Wetland Vegetation issue (0+000 to 0+060),"The ROW is revegetating well, but few wetland species were observed during the field survey. The majority of the wetland and wetland species appear to be north of the pipeline ROW, the construction of the pipeline has had limited to no impact on the vegetative composition of the ROW.","July 10, 2015 - The area continues to revegetate with bunch and creeping grasses spreading throughout the ROW. - No erosion, subsidence or integrity concerns were identified. Oct 6, 2015 - The area continues to revegetate with bunch and creeping grasses spreading throughout the ROW. - No erosion, subsidence or integrity concerns were identified.","June 15, 2016 - Tract is located adjacent to crop land which is currently seeded to peas. - The area is continuing to revegetate with bunch and creeping grasses spreading throughout the ROW. - No erosion, subsidence or integrity concerns were identified. August 19, 2016 - Tract is located adjacent to crop land which is currently seeded to peas. - The area continues to revegetate with bunch and creeping grasses spreading throughout the ROW. - No erosion, subsidence or integrity concerns were identified.","Sept 20, 2017  - Class III wetland on ROW from KP 0+000 to 0+060 appears to be at baseline, full functionality. - Vegetation establishment throughout wetland is at 80-100% cover compared to off ROW control. Vegetation consisting of herbaceous graminoids and willows. Good establishment of hydrophytic vegetation (common cattail, lilly pads). - No trench crown present through wetland; hydrology has been maintained across ROW. No subsidence or erosional issues identified in wetland. - Substrate in wetland appears healthy through uniform vegetation growth and high moisture retention capabilities. Some humification occurring throughout wetland through the decomposing vegetation litter. Moderate organic content in topsoil layer and high salinity in wetland as indicated through coloration of dried up areas of wetland; comparing with off ROW conditions. - Substrate exhibiting semi to fully saturated conditions, comparing with off ROW conditions resulting in intermittent areas of standing water throughout wetland. - Wetland providing good habitat opportunity through good vegetation cover and standing water. - Wetland has achieved pre-construction contours. Off ROW species successfully emerging onto ROW; species diversity maintained. Overall, no net loss of wetland function was observed.","August 14, 2018 - Class III wetland on ROW from KP 0+000 to 0+060 appears to be at baseline (pre-construction) conditions with no net apparent loss of wetland function observed. Proper wetland functionality has been attained. The wetland on ROW is proceeding to an open water pond to the north of the ROW. - Vegetation establishment throughout wetland is at 80-100% cover compared to off ROW control. - Vegetation consisting of herbaceous graminoids and willows. Good establishment of hydrophytic vegetation (common cattail, lilly pads and duckweed) in standing water areas. - No trench crown present through wetland; hydrology has been maintained across ROW with no apparent issues of hydrologic connectivity noted. - Substrate in wetland appears healthy through uniform vegetation growth and high moisture retention capabilities. Some humification occurring throughout wetland through the decomposing vegetation litter. Moderate organic content in topsoil layer comparing with off ROW conditions. Organic scent emitting from standing water areas indicating the effective decomposition of plant material via bacterial organisms. - Substrate exhibiting semi to fully saturated conditions with saturation increasing to the north leading to large open pond area. Intermittent areas of standing water present on ROW (depth 5-10cm). - Wetland providing good habitat opportunity through good vegetation cover and standing water. Five (5) mallards were observed in the wetland on the ROW and 20+ mallards observed in open water pond off ROW to the north.  - Wetland has achieved pre-construction contours with no signs of ponding, erosion or subsidence issues throughout. Vegetation biodiversity has been attained across the ROW.",,,
SE 1-54-15 W4,Wetland Noxious weed issue (0+000 to 0+075),Noxious weeds are present (Canada thistle and perennial sow thistle). Noxious weeds are more severe off ROW.,"July 10, 2015 - Assessed weeds throughout tract - Canada Thistle, Perennial Sow Thistle, Narrow Leaf Hawkweed, Common Tansy and large amount of sweet clover were observed directly east of the valve site and the western bar ditch of Hwy 857.  Oct 6, 2015 - Canada Thistle, Perennial Sow Thistle, Narrow Leaf Hawkweed, were observed directly east of the valve site and the western bar ditch of Hwy 857.  - Recommend monitoring with possible vegetation control for next growing season all vegetation killed by frost","June 15, 2016 - Canada Thistle, Perennial Sow Thistle, Narrow Leaf Hawkweed, Common Tansy and large amount of sweet clover were observed directly east of the valve site and the western bar ditch of Hwy 857. Recommend implementation of vegetation control. August 19, 2016 - Canada thistle, Narrow Leaf Hawkweed, were observed directly east of the valve site and the western bar ditch of Hwy 857. Recommend implementation of vegetation control. September 22, 2016 - Intermittent herbicide application (spot spraying) conducted to control Perennial Sow Thistle and Canada Thistle. Narrow Leaf Hawkweed and Common Tansy were no longer present.","July 31, 2017 - Observed perennial sow thistle and Canada thistle on ROW, recommend weed control. September 20, 2017 – Weed control measures implemented to control foxtail barley, Canada thistle, and perennial sow thistle. Issue resolved.","August 14, 2018 - Perennial sow thistle present in wetland on the southern edge of ROW.  September 21, 2018 – Intermittent herbicide application conducted to control perennial sow thistle. Issue resolved.",,,
SW 6-54-14 W4,Cropland Noxious weed issue (0+075 to 0+250),"Located on a small natural wet area. Noxious weeds (Canada thistle and perennial sow thistle) are present, which will be managed by normal farming operations.","July 10, 2015 - Tract is located in cropland and is currently producing canola - Tract was not accessed due to landowner concerns with access through seeded field. - No concerns were visible from boundary  Oct 6, 2015 - Tract is currently in Canola and not harvested, therefore the tract was not accessed. - No concerns were visible from boundary","June 15, 2016 - Crop land currently seeded to wheat. - Tract has areas of reduced crop density from KP 0+500 to 0+700. August 19, 2016 - Crop land currently seeded to wheat. - Tract has areas of reduced crop density from KP 0+500 to 0+700. - Weeds, noted in 2014, are managed by landowner during farming operations, issue resolved.","July 26, 2017  - Tract is seeded to canola. - Completed follow up vegetation assessment for reduced density observed in 2016 from 0+500 to 0+700. Consistent variable crop conditions were observed on and off ROW. No further monitoring recommended, issue resolved. Sept 20, 2017 - Class II wetland on ROW from KP 0+110 to 0+140 (in temporary work space on ROW) appears to be at baseline, full functionality. Wetland begins on northern edge of temporary work space and extends off ROW to the north. - Vegetation establishment throughout wetland is at 80-100% cover compared to off ROW control. Vegetation consisting of herbaceous graminoids. Good establishment of hydrophytic vegetation (common cattail, - No trench crown present through wetland; hydrology has been maintained across ROW. No subsidence or erosional issues identified in wetland. - Substrate in wetland appears healthy through uniform vegetation growth and high moisture retention capabilities. Some humification occurring throughout wetland through the decomposing vegetation litter. Moderate organic content in topsoil layer and high salinity in wetland as indicated through colouration of dried up areas of wetland; comparing with off ROW conditions. - Substrate exhibiting semi to fully saturated conditions, comparing with off ROW conditions. Saturation increases to the north due to down sloping terrain. - Mallards observed using wetland off ROW to the north. - Wetland has achieved pre-construction contours. Off ROW species successfully emerging onto ROW; species diversity maintained. Overall, no net loss of wetland function was observed.","June 12, 2018 - 80-100% vegetation cover compared to off ROW. Field seeded to cereal crop. - No erosion or subsidence observed on ROW August 14, 2018 - Class II wetland on ROW from KP 0+110 to 0+140 appears to be at baseline (pre-construction) conditions with no net apparent loss of wetland function observed. Proper wetland functionality has been attained. The wetland on ROW is proceeding to an open water pond to the north of the ROW. - Vegetation establishment throughout wetland is at 80-100% cover compared to off ROW control with the majority of the ROW currently planted to oats. Crop height on ROW is similar to off ROW; no issues. - Vegetation consisting of herbaceous graminoids. Good establishment of hydrophytic vegetation (common cattail, lily pads and duckweed) in standing water areas. - Weeds present in consistent density on and off ROW, no work required. - No trench crown present through wetland; hydrology has been maintained across ROW with no apparent issues of hydrologic connectivity noted. - Substrate in wetland appears healthy through uniform vegetation growth and high moisture retention capabilities. Some humification occurring throughout wetland through the decomposing vegetation litter. Moderate organic content in topsoil layer comparing with off ROW conditions. - Substrate exhibiting semi to fully saturated conditions with saturation increasing to the north leading to large open pond area. Standing water present on ROW (depth 5-10cm). - Wetland providing good habitat opportunity through good vegetation cover and standing water. Killdeer observed on ROW in standing water area.  - Wetland has achieved pre-construction contours with no signs of ponding, erosion or subsidence issues throughout. Vegetation biodiversity has been attained across the ROW.",,,
SW 6-54-14 W4,Cropland Noxious weed issue (0+415 to 0+465),Site is on the edge of a small natural wet area that extends 25m to the south of the ROW. Noxious weeds (Canada thistle) are present.,"July 10, 2015 - Tract is located in cropland and is currently producing canola - Tract was not accessed due to landowner concerns with access through seeded field. Oct 6, 2015 - Tract is currently in Canola and not harvested, therefore the tract was not accessed.","June 15, 2016 - Crop land currently seeded to wheat. - Tract has areas of reduced crop density from KP 0+500 to 0+700. August 19, 2016 - Crop land currently seeded to wheat. - Tract has areas of reduced crop density from KP 0+500 to 0+700. - Weeds, noted in 2014, are managed by landowner during farming operations, issue resolved.","July 26, 2017  - Tract is seeded to canola. - Completed follow up vegetation assessment for reduced density observed in 2016 from 0+500 to 0+700. Consistent variable crop conditions were observed on and off ROW. No further monitoring recommended, issue resolved. Sept 20, 2017 - Class II wetland on ROW from KP 0+110 to 0+140 (in temporary work space on ROW) appears to be at baseline, full functionality. Wetland begins on northern edge of temporary work space and extends off ROW to the north. - Vegetation establishment throughout wetland is at 80-100% cover compared to off ROW control. Vegetation consisting of herbaceous graminoids. Good establishment of hydrophytic vegetation (common cattail, - No trench crown present through wetland; hydrology has been maintained across ROW. No subsidence or erosional issues identified in wetland. - Substrate in wetland appears healthy through uniform vegetation growth and high moisture retention capabilities. Some humification occurring throughout wetland through the decomposing vegetation litter. Moderate organic content in topsoil layer and high salinity in wetland as indicated through colouration of dried up areas of wetland; comparing with off ROW conditions. - Substrate exhibiting semi to fully saturated conditions, comparing with off ROW conditions. Saturation increases to the north due to down sloping terrain. - Mallards observed using wetland off ROW to the north. - Wetland has achieved pre-construction contours. Off ROW species successfully emerging onto ROW; species diversity maintained. Overall, no net loss of wetland function was observed.","June 12, 2018 - 80-100% vegetation cover compared to off ROW. Field seeded to cereal crop. - No erosion or subsidence observed on ROW August 14, 2018 - Class II wetland on ROW from KP 0+110 to 0+140 appears to be at baseline (pre-construction) conditions with no net apparent loss of wetland function observed. Proper wetland functionality has been attained. The wetland on ROW is proceeding to an open water pond to the north of the ROW. - Vegetation establishment throughout wetland is at 80-100% cover compared to off ROW control with the majority of the ROW currently planted to oats. Crop height on ROW is similar to off ROW; no issues. - Vegetation consisting of herbaceous graminoids. Good establishment of hydrophytic vegetation (common cattail, lily pads and duckweed) in standing water areas. - Weeds present in consistent density on and off ROW, no work required. - No trench crown present through wetland; hydrology has been maintained across ROW with no apparent issues of hydrologic connectivity noted. - Substrate in wetland appears healthy through uniform vegetation growth and high moisture retention capabilities. Some humification occurring throughout wetland through the decomposing vegetation litter. Moderate organic content in topsoil layer comparing with off ROW conditions. - Substrate exhibiting semi to fully saturated conditions with saturation increasing to the north leading to large open pond area. Standing water present on ROW (depth 5-10cm). - Wetland providing good habitat opportunity through good vegetation cover and standing water. Killdeer observed on ROW in standing water area.  - Wetland has achieved pre-construction contours with no signs of ponding, erosion or subsidence issues throughout. Vegetation biodiversity has been attained across the ROW.",,,
SW 6-54-14 W4,Cropland No issue observed (0+700),Crop is comparable to the Control. Landowner’s refuse storage site was located just off the ROW.,"July 10, 2015 - Tract is located in cropland and is currently producing canola - Tract was not accessed due to landowner concerns with access through seeded field. Oct 6, 2015 - Tract is currently in Canola and not harvested, therefore the tract was not accessed.","June 15, 2016 - Crop land currently seeded to wheat. - Tract has areas of reduced crop density from KP 0+500 to 0+700. August 19, 2016 - Crop land currently seeded to wheat. - Tract has areas of reduced crop density from KP 0+500 to 0+700. - Weeds, noted in 2014, are managed by landowner during farming operations, issue resolved.","July 26, 2017  - Tract is seeded to canola. - Completed follow up vegetation assessment for reduced density observed in 2016 from 0+500 to 0+700. Consistent variable crop conditions were observed on and off ROW. No further monitoring recommended, issue resolved. Sept 20, 2017 - Class II wetland on ROW from KP 0+110 to 0+140 (in temporary work space on ROW) appears to be at baseline, full functionality. Wetland begins on northern edge of temporary work space and extends off ROW to the north. - Vegetation establishment throughout wetland is at 80-100% cover compared to off ROW control. Vegetation consisting of herbaceous graminoids. Good establishment of hydrophytic vegetation (common cattail, - No trench crown present through wetland; hydrology has been maintained across ROW. No subsidence or erosional issues identified in wetland. - Substrate in wetland appears healthy through uniform vegetation growth and high moisture retention capabilities. Some humification occurring throughout wetland through the decomposing vegetation litter. Moderate organic content in topsoil layer and high salinity in wetland as indicated through colouration of dried up areas of wetland; comparing with off ROW conditions. - Substrate exhibiting semi to fully saturated conditions, comparing with off ROW conditions. Saturation increases to the north due to down sloping terrain. - Mallards observed using wetland off ROW to the north. - Wetland has achieved pre-construction contours. Off ROW species successfully emerging onto ROW; species diversity maintained. Overall, no net loss of wetland function was observed.","June 12, 2018 - 80-100% vegetation cover compared to off ROW. Field seeded to cereal crop. - No erosion or subsidence observed on ROW August 14, 2018 - Class II wetland on ROW from KP 0+110 to 0+140 appears to be at baseline (pre-construction) conditions with no net apparent loss of wetland function observed. Proper wetland functionality has been attained. The wetland on ROW is proceeding to an open water pond to the north of the ROW. - Vegetation establishment throughout wetland is at 80-100% cover compared to off ROW control with the majority of the ROW currently planted to oats. Crop height on ROW is similar to off ROW; no issues. - Vegetation consisting of herbaceous graminoids. Good establishment of hydrophytic vegetation (common cattail, lily pads and duckweed) in standing water areas. - Weeds present in consistent density on and off ROW, no work required. - No trench crown present through wetland; hydrology has been maintained across ROW with no apparent issues of hydrologic connectivity noted. - Substrate in wetland appears healthy through uniform vegetation growth and high moisture retention capabilities. Some humification occurring throughout wetland through the decomposing vegetation litter. Moderate organic content in topsoil layer comparing with off ROW conditions. - Substrate exhibiting semi to fully saturated conditions with saturation increasing to the north leading to large open pond area. Standing water present on ROW (depth 5-10cm). - Wetland providing good habitat opportunity through good vegetation cover and standing water. Killdeer observed on ROW in standing water area.  - Wetland has achieved pre-construction contours with no signs of ponding, erosion or subsidence issues throughout. Vegetation biodiversity has been attained across the ROW.",,,
,Wetland Noxious weed issue (0+720 to 0+760),"Class II wetland observed. Scentless chamomile was observed on the ROW. Moderate issue as the noxious weeds were picked, bagged and sealed in a plastic bag and properly disposed of (approx. 10 plants).","July 10, 2015 - Tract was not accessed due to landowner concerns with access through seeded field. Oct 6, 2015 - Tract was not accessed due to landowner concerns with access through seeded field.","June 15, 2016 - Scentless chamomile is no longer evident, issue resolved.","Sept 20, 2017 - Class II wetland on ROW from KP 0+720 to 0+760 appears to be at baseline, full functionality. - Vegetation establishment throughout wetland is at 80-100% cover compared to off ROW control (minimal vegetation growth in wetland due to fluctuating water levels in area. Dominant vegetation consisting of herbaceous graminoids including common cattail. - No trench crown present through wetland; hydrology has been maintained across ROW. No subsidence or erosional issues identified in wetland. - Substrate in wetland appears healthy through uniform vegetation growth and high moisture retention capabilities. Some humification occurring throughout wetland through the decomposing vegetation litter. Moderate organic content in topsoil layer and high salinity in wetland as indicated through colouration of dried up areas of wetland; comparing with off ROW conditions. - Substrate exhibiting dry conditions, comparing with off ROW conditions; no standing water present in wetland. - Wetland has achieved pre-construction contours. Overall, no net loss of wetland function was observed.","August 14, 2018 - Class II wetland on ROW from KP 0+720 to 0+760 appears to be at baseline (pre-construction) conditions with no net apparent loss of wetland function observed. Proper wetland functionality has been attained. The wetland on ROW is inclusive of low depression within cultivated field (currently planted to oats). - Vegetation establishment throughout wetland is at 80-100% cover compared to off ROW control with the majority of the ROW currently planted to oats. Crop height on ROW is similar to off ROW; no issues. - Vegetation consisting of herbaceous graminoids. Good establishment of hydrophytic vegetation (common cattail and duckweed) in standing water areas. - No trench crown present through wetland; hydrology has been maintained across ROW with no apparent issues of hydrologic connectivity noted. - Substrate in wetland appears healthy through uniform vegetation growth and high moisture retention capabilities. Some humification occurring throughout wetland through the decomposing vegetation litter. Moderate organic content in topsoil layer comparing with off ROW conditions. - Substrate exhibiting semi-saturated conditions with no standing water present on or off ROW. - Wetland providing good habitat opportunity through good vegetation cover. No wildlife observed in wetland on or off ROW. - Wetland has achieved pre-construction contours with no signs of ponding, erosion or subsidence issues throughout. Vegetation biodiversity has been attained across the ROW.",,,
,Cropland Microtopography issue (0+775 to 0+855),There is approximately a 5 cm to 10 cm difference between grade on and off ROW. This may be associated with an old fence line. Topsoil was greater than 29 cm was observed on the ROW and on the control. The uneven topography can be attributed to the old fence line. No soil issues were observed.,"July 10, 2015 - Tract is located in cropland and is currently producing canola. - Tract was not accessed due to landowner concerns with access through seeded field. - No concerns were visible from boundary. Oct 6, 2015 - Tract is currently in Canola and not harvested, therefore the tract was not accessed.","June 15, 2016 - No indications of crop being affected by microtopography issue noted in 2014 (KP 0+775 to 0+855), issue resolved.",N/A,N/A,,,
,Cropland Vegetation issue (0+775 to 0+855),Crop height and density decreased compared to the off-ROW Control. Noxious weeds (Canada thistle) are present which will be managed by normal farming operations.,"July 10, 2015 - Tract is located in cropland and is currently producing canola - Tract was not accessed due to landowner concerns with access through seeded field. - No concerns were visible from boundary  Oct 6, 2015 - Tract is currently in Canola and not harvested, therefore the tract was not accessed.","June 15, 2016 - No indications of crop being affected by microtopography issue noted in 2014 (KP 0+775 to 0+855), issue resolved.",N/A,N/A,,,
SE 6-54-14 W4,Treed Vegetation issue (0+900 to 0+920),Drainage ditch (man-made) to the east. High percent cover of invasive plants and nuisance weeds were observed; few desirable species present.,"July 10, 2015 - Tract is located in crop land however a shelterbelt along the western boundary of the quarter section was removed during construction.  - Canada Thistle, Perennial Sow Thistle, Narrow Leaf Hawkweed and Common Tansy were identified in the location of the previous shelterbelt. - Recommend vegetation control","Monitor in 2017 and implement weed control, as required.","July 31, 2017 - Tract is seeded to wheat; previous location of weed control is grassy area between quarters along undeveloped road allowance - Observed a few sporadic individuals of perennial sow thistle and Canada thistle, less than observed off ROW. No further weed control required, issue resolved.","June 12, 2018 - 80-100% vegetation cover compared to off ROW appears to be seeded to wheat. - No erosion or subsidence observed on ROW - Canada thistle observed within grassy area between quarters along undeveloped road allowance. Recommend weed control. July 21, 2018 – Herbicide application conducted within grassy area along undeveloped road allowance to control Canada thistle.",,,
